description,component
"Komputer sering restart tiba-tiba dan muncul layar biru",RAM
"Komputer tidak bisa booting, hanya muncul layar hitam",Hard Disk
"Suara bip panjang saat komputer dinyalakan, tidak masuk ke sistem",Motherboard
"Komputer berjalan sangat lambat dan sering hang",RAM
"File sering corrupt dan ada suara klik dari hard disk",Hard Disk
"Komputer tidak mendeteksi perangkat USB",Motherboard
"Monitor tidak menampilkan gambar meskipun komputer sudah dinyalakan",Graphic Card
"Komputer overheat setelah beberapa menit penggunaan",Processor
"Komputer tiba-tiba mati saat menjalankan aplikasi berat",Power Supply
"Ada bau terbakar dari dalam casing komputer saat dinyalakan",Power Supply
"Komputer sangat lambat dan aplikasi sering crash",RAM
"Monitor berkedip-kedip dan menampilkan garis-garis",Graphic Card
"Komputer tidak bisa membaca hard disk",Hard Disk
"Komputer sering restart dan ada suara keras dari kipas",Power Supply
"Tidak ada suara saat komputer dinyalakan",Motherboard
"Port USB tidak berfungsi meski sudah coba beberapa perangkat",Motherboard
"Komputer menyala tetapi tidak ada tampilan di monitor",Graphic Card
"Komputer tiba-tiba mati saat digunakan untuk rendering video",Processor
"Ada bau terbakar dan asap dari komputer",Power Supply
"Komputer tidak mendeteksi hard disk pada BIOS",Hard Disk
"Monitor tidak menyala meskipun komputer sudah dihidupkan",Graphic Card
"Komputer mengalami overheat saat digunakan dalam waktu lama",Processor
"Komputer nyala tapi tidak tampil di layar",Graphic Card
"Komputer saat menjalani game berat langsung mati",Processor
"Layar muncul seperti kesemutan atau kedap kedip",Graphic Card
"Komputer tidak bisa menyala meskipun sudah ditekan tombol power",Power Supply
"Layar komputer sering mati sendiri setelah digunakan beberapa saat",Graphic Card
"Komputer berjalan sangat lambat saat membuka aplikasi",Processor
"Saat booting muncul pesan error 'no bootable device found'",Hard Disk
"Blue screen secara tiba-tiba saat sedang bekerja",RAM
"USB port tidak mendeteksi perangkat apapun",Motherboard
"Setelah upgrade RAM, komputer tidak mau menyala",RAM
"Aplikasi sering crash dan restart secara otomatis",Hard Disk
"PC tiba-tiba mati terus kalo main game, padahal sebelumnya aman-aman aja",Power Supply
"Kayaknya RAM-nya deh, soalnya komputernya nge-freeze mulu tiap buka banyak tab",RAM
"Pas nyalain PC, malah ada suara 'bip' panjang, layarnya tetep gelap",Motherboard
"Hardisk kayaknya rusak deh, soalnya file-file gue pada hilang dan suka ada suara aneh dari CPU",Hard Disk
"Udah dicolokin USB-nya tapi gak kebaca sama sekali, udah coba ganti-ganti colokan juga",Motherboard
"Monitor gak nyala, tapi kipas CPU jalan, kira-kira kenapa ya?",Graphic Card
"PC gue cepet panas banget kalo dipake render, bisa mati sendiri",Processor
"Komputer suka restart sendiri tiba-tiba, mungkin karena power supply-nya kali ya",Power Supply
"Setiap kali nyalain komputer, ada bau kayak kebakar dari casing, serem sih",Power Supply
"Pas main game berat, komputernya langsung nge-lag parah terus crash",RAM
"Monitor suka ada garis-garis aneh, terus gambarnya juga jadi buram",Graphic Card
"Baru upgrade RAM, tapi sekarang PC malah gak nyala, kenapa ya?",RAM
"USB udah dicolokin tapi gak ke-detect, padahal kemarin masih normal",Motherboard
"Komputer suka freeze tiap kali buka aplikasi berat, jalannya jadi lambat banget",Processor
"Komputer suka restart sendiri, terus ada suara kipas kenceng banget",Power Supply
"Pas nyalain komputer, gak ada suara 'beep' sama sekali, kayak mati total gitu",Motherboard
"Hardisk gak kebaca pas masuk BIOS, udah restart beberapa kali tetep sama",Hard Disk
"PC suka ngelag pas dipake nonton film HD, padahal dulu lancar banget",RAM
"Komputer tiba-tiba mati saat nyoba buka file besar, terus gak bisa nyala lagi",Power Supply
"Layar suka kedip-kedip pas lagi browsing, udah restart tetep sama",Graphic Card
"Baru beberapa menit dipake, komputer udah panas banget, CPU fan bunyi kenceng",Processor
"USB gak ke-detect sama sekali, udah coba beberapa kali tetep gak bisa",Motherboard
"Komputer kadang mati sendiri waktu baru dinyalain, terus susah nyala lagi",Power Supply
"PC nge-freeze pas mau transfer file dari hardisk eksternal, terus tiba-tiba mati",Hard Disk
"Setiap buka aplikasi google youtube dan lainnya, komputer suka lambat banget, nge-lag parah",RAM
"Monitor gak nyala padahal kabel udah terpasang, cuma CPU yang kedengeran bunyinya",Graphic Card
"PC overheat terus mati mendadak tiap kali dipake buat rendering video",Processor
"Ada bau gosong dari power supply waktu komputer dinyalain",Power Supply
"Komputer gak bisa booting, cuma layar hitam doang yang muncul",Hard Disk
"Pas nyalain komputer, muncul suara bip panjang, terus gak masuk ke Windows",Motherboard
"PC tiba-tiba hang terus restart sendiri, sering banget terjadi",RAM
"Monitor cuma hitam aja, gak ada gambar, padahal PC nyala normal",Graphic Card
"Komputer gue sering restart tiba-tiba kalau lagi main game, bingung kenapa",Power Supply
"USB port gak berfungsi, udah coba colokin mouse dan keyboard tapi gak kedetect",Motherboard
"PC tiba-tiba mati waktu gue lagi transfer file ke hardisk",Hard Disk
"Layar tiba-tiba kedap kedip pas lagi streaming, padahal sebelumnya gak apa-apa",Graphic Card
"Komputer suka panas banget meski cuma dipake browsing biasa",Processor
"Hardisk gak bisa kebaca, jadi gak bisa booting sama sekali",Hard Disk
"Suara kipas CPU kenceng banget terus PC tiba-tiba mati sendiri",Power Supply
"Pas buka program desain, PC langsung lambat terus sering nge-freeze",RAM
"Monitor gak nyala, udah coba ganti kabel tetep gak ada tampilan",Graphic Card
"PC gue cepet banget overheat, abis dipake beberapa menit langsung panas",Processor
"Komputer tiba-tiba mati pas lagi download file besar",Power Supply
"Layar monitor berkedip-kedip terus muncul garis-garis aneh",Graphic Card
"PC suka mati mendadak kalau dipake buat ngedit video",Processor
"Ada suara klik dari hardisk terus file gue jadi sering corrupt",Hard Disk
"Monitor gak nampil apa-apa, tapi kipas CPU nyala normal",Graphic Card
"Komputer nyala tapi cuma ada layar hitam, gak masuk ke BIOS",Hard Disk
"Pas mau buka game, PC langsung mati mendadak",Power Supply
"Komputer lemot banget setiap buka aplikasi berat kayak Photoshop",RAM
"Monitor gue tiba-tiba buram terus ada garis-garis",Graphic Card
"PC tiba-tiba mati pas gue lagi bikin video editing",Processor
"Setiap nyalain komputer ada suara aneh dari hardisk, kayak klik-klik gitu",Hard Disk
"USB port gak bisa kebaca meski udah coba beberapa device",Motherboard
"Setiap buka aplikasi berat, komputer suka freeze beberapa detik",Processor
"Komputer tiba-tiba restart sendiri pas lagi browsing",Power Supply
"Layar komputer gue jadi blur dan suka ada flicker",Graphic Card
"Komputer lambat banget setiap buka aplikasi desain, kayak RAM-nya kurang",RAM
"Monitor gak mau nyala meskipun komputer udah running normal",Graphic Card
"Setiap buka game berat, komputer langsung mati total",Power Supply
"PC tiba-tiba mati terus ada suara bip panjang, gak bisa masuk ke Windows",Motherboard
"Komputer panas banget pas dipake multitasking, terus hang",Processor
"Hardisk gak kebaca sama sekali waktu booting, muncul error no bootable device",Hard Disk
"Komputer tiba-tiba mati, terus ada bau terbakar dari power supply",Power Supply
"USB port belakang komputer gak bisa dipake, semua device gak kedetect",Motherboard
"Layar monitor jadi kedip-kedip terus muncul garis horizontal",Graphic Card
"Pas buka banyak tab di browser, komputer langsung nge-lag parah",RAM
"PC tiba-tiba nge-freeze pas dipake nonton film, padahal sebelumnya lancar banget",RAM
"Komputer mati mendadak waktu buka aplikasi berat, terus gak bisa nyala",Power Supply
"Layar sering kedip-kedip waktu dipake browsing, meski udah restart tetap gak berubah",Graphic Card
"Baru beberapa menit dipake, komputer udah panas banget dan kipas CPU bunyi kenceng",Processor
"Komputer tiba-tiba mati sendiri waktu baru dinyalain, terus susah banget buat nyalain lagi",Power Supply
"PC nge-freeze pas transfer file besar dari hard disk eksternal, terus tiba-tiba mati",Hard Disk
"Setelah di-upgrade RAM, komputer tidak mau booting",RAM
"Komputer sering freeze ketika membuka aplikasi editing",RAM
"Suara aneh keluar dari hard disk saat diakses",Hard Disk
"Komputer mati mendadak saat bermain game online",Power Supply
"Monitor tidak merespons saat komputer dihidupkan",Graphic Card
"PC sering restart sendiri tanpa alasan jelas",Motherboard
"Komputer tidak mendeteksi RAM setelah diinstal ulang",RAM
"Komputer berjalan lambat ketika terhubung ke internet",Processor
"Ada suara klik yang mencurigakan dari hard disk",Hard Disk
"Komputer tidak bisa booting setelah memasang GPU baru",Graphic Card
"Suara beep pendek saat booting, tidak ada tampilan",Motherboard
"Monitor hitam meski semua komponen lainnya menyala",Graphic Card
"Komputer mengeluarkan suara aneh dari power supply",Power Supply
"Komputer tiba-tiba hang saat melakukan rendering",Processor
"Setelah restart, BIOS tidak mendeteksi hard disk",Hard Disk
"Komputer menjadi sangat lambat setelah menginstal aplikasi baru",RAM
"Port USB depan tidak berfungsi, sudah coba ganti kabel",Motherboard
"Komputer tidak merespons saat menyalakan aplikasi berat",Processor
"Monitor berkedip dan tampilan sering hilang",Graphic Card
"Komputer mati total saat terhubung ke sumber listrik",Power Supply
"Setelah mengganti hard disk, sistem tidak mau boot",Hard Disk
"Komputer sering freeze saat bermain game berat",RAM
"Monitor hanya menampilkan warna hitam setelah dinyalakan",Graphic Card
"Komputer reboot sendiri saat mendownload file besar",Power Supply
"Setiap kali menghidupkan, suara beep panjang muncul",Motherboard
"Hard disk tidak terdeteksi di pengaturan BIOS",Hard Disk
"Setelah upgrade CPU, komputer sering hang",Processor
"USB port tidak berfungsi pada semua perangkat yang dicoba",Motherboard
"PC overheat saat digunakan untuk gaming, menyebabkan shutdown",Processor
"Komputer berjalan lambat dan sering crash ketika multitasking",RAM
"Monitor menampilkan garis-garis dan kadang blank",Graphic Card
"Setiap kali membuka aplikasi berat, PC tiba-tiba mati",Power Supply
"Setelah mengganti RAM, komputer tetap tidak mau menyala",RAM
"Komputer mengeluarkan suara berisik saat booting",Motherboard
"Suara kipas sangat keras dan PC sering mati mendadak",Power Supply
"Hard disk bergetar lebih dari biasanya saat diakses",Hard Disk
"Monitor tidak mengeluarkan suara, meskipun komputer menyala",Graphic Card
"Komputer terkadang tidak merespons saat dinyalakan",Motherboard
"Setiap kali menjalankan program, komputer sangat lambat",Processor
"Komputer mengeluarkan bau terbakar saat dinyalakan",Power Supply
"Setelah upgrade GPU, komputer tidak bisa booting",Graphic Card
"USB mouse tidak terdeteksi di komputer",Motherboard
"Komputer freeze saat melakukan streaming video",RAM
"Monitor mengeluarkan suara dengung saat menyala",Graphic Card
"PC reboot sendiri saat digunakan untuk gaming",Power Supply
"Hard disk sering menghasilkan suara aneh saat diakses",Hard Disk
"Setiap kali dinyalakan, BIOS menunjukkan kesalahan",Motherboard
"Komputer mati mendadak saat membuka aplikasi besar",Power Supply
"Monitor tidak memberikan tampilan apapun meski menyala",Graphic Card
"PC sangat lambat saat melakukan transfer data besar",RAM
"Komputer tidak merespons setelah dihidupkan, layar tetap hitam",Motherboard
"Suara bip berulang saat dinyalakan, tidak ada tampilan",Motherboard
"Komputer overheat dan mati saat menjalankan aplikasi berat",Processor
"Komputer tidak mau menyala setelah di-upgrade motherboard",Motherboard
"Monitor berkedip saat dipakai browsing",Graphic Card
"PC mengalami lag parah saat bermain game ringan",RAM
"Setelah mengganti power supply, komputer tetap mati mendadak",Power Supply
"Hard disk tidak dapat dibaca di sistem operasi setelah restart",Hard Disk
"Komputer sering restart saat membuka beberapa tab",RAM
"Setiap kali menghidupkan, tampilan monitor kosong",Graphic Card
"Suara klik dari hard disk semakin sering terjadi",Hard Disk
"Komputer hang saat melakukan update sistem",Processor
"Monitor menampilkan gambar buram saat dinyalakan",Graphic Card
"Setelah upgrade CPU, komputer tidak booting",Motherboard
"PC sering mati mendadak saat streaming video",Power Supply
"Komputer freeze ketika membuka aplikasi grafis",RAM
"Monitor tidak menampilkan gambar setelah dinyalakan",Graphic Card
"Komputer tidak mendeteksi jaringan setelah restart",Motherboard
"Suara bising dari kipas yang berputar sangat cepat",Power Supply
"Komputer berjalan lambat saat menggunakan aplikasi berat",Processor
"Monitor menampilkan garis-garis saat bermain game",Graphic Card
"Hard disk berfungsi tidak normal setelah terjatuh",Hard Disk
"Komputer restart sendiri saat terhubung ke internet",Motherboard
"Setiap kali dinyalakan, muncul pesan kesalahan sistem",Power Supply
"Komputer tidak mengenali perangkat USB yang terhubung",Motherboard
"PC hang saat mendownload file besar dari internet",RAM
"Monitor kadang blank meski komputer menyala",Graphic Card
"Suara berisik dari power supply saat dihidupkan",Power Supply
"Komputer sangat lambat setelah menginstal aplikasi baru",RAM
"Hard disk tidak terdeteksi di file explorer",Hard Disk
"Setelah mengganti RAM, komputer masih tidak menyala",RAM
"PC tiba-tiba mati saat melakukan render video",Power Supply
"Monitor sering menampilkan gambar kabur saat browsing",Graphic Card
"Komputer tidak bisa booting setelah install ulang OS",Hard Disk
"Suara bip pendek saat booting, sistem tidak merespons",Motherboard
"Komputer menjadi lambat setelah di-upgrade",Processor
"Setiap kali menjalankan aplikasi berat, komputer sering freeze",RAM
"Monitor tidak merespons saat dihidupkan",Graphic Card
"Komputer mati total saat menggunakan aplikasi desain",Processor
"Hard disk mengeluarkan suara klik-klik saat diakses",Hard Disk
"Komputer tidak mau boot setelah mengganti GPU",Graphic Card
"USB port belakang tidak berfungsi pada semua perangkat",Motherboard
"Komputer hang saat menjalankan aplikasi video editing",RAM
"Monitor tidak menampilkan gambar saat dinyalakan",Graphic Card
"PC sering restart mendadak saat gaming",Power Supply
"Komputer terlalu panas setelah dipakai beberapa jam",Processor
"Hard disk sering menunjukkan kesalahan saat diakses",Hard Disk
"Monitor hitam meski semua komponen menyala",Graphic Card
"Setiap kali booting, komputer mengeluarkan suara aneh",Motherboard
"Komputer restart tiba-tiba setelah update BIOS",Motherboard
"PC tidak bisa mendeteksi keyboard dan mouse",Motherboard
"Komputer hang saat membuka file Excel berukuran besar",RAM
"Suara kipas keras tetapi komputer tidak menyala",Power Supply
"Monitor menampilkan layar biru setelah beberapa menit digunakan",Graphic Card
"Komputer mati sendiri saat digunakan untuk presentasi",Power Supply
"PC tidak merespons setelah instalasi driver baru",Motherboard
"Komputer menjadi lambat setelah beberapa jam pemakaian",Processor
"Layar monitor tiba-tiba blank saat streaming video",Graphic Card
"Komputer tidak bisa menyala setelah melakukan update Windows",Motherboard
"Komputer mengeluarkan suara bip panjang dan tidak bisa masuk ke BIOS",Motherboard
"Hard disk sering berhenti bekerja dan komputer hang",Hard Disk
"PC lambat setiap kali membuka aplikasi desain grafis",RAM
"Suara klik dari hard disk meningkat saat dipakai transfer file",Hard Disk
"Komputer restart setelah menginstal update driver GPU",Graphic Card
"Monitor tidak merespons setelah mengganti kabel",Graphic Card
"Komputer sering overheat saat menjalankan software 3D",Processor
"Komputer tidak mengenali hard disk eksternal",Hard Disk
"Setelah mengganti motherboard, komputer tidak mau booting",Motherboard
"Layar monitor sering blank saat digunakan bekerja",Graphic Card
"Komputer terlalu lambat saat melakukan rendering video",Processor
"Suara kipas sangat keras setelah komputer dinyalakan",Power Supply
"Setelah upgrade power supply, PC tetap mati mendadak",Power Supply
"Komputer mati tiba-tiba saat browsing internet",Power Supply
"Komputer freeze ketika menjalankan program simulasi",RAM
"Monitor menampilkan artefak setelah komputer menyala",Graphic Card
"Komputer hang saat membuka banyak tab di browser",RAM
"Komputer restart setelah menyalakan aplikasi editing video",Power Supply
"Hard disk tidak merespons setelah terhubung ke komputer",Hard Disk
"Komputer tidak bisa booting setelah memasang RAM baru",RAM
"Komputer mengeluarkan suara bip berulang kali saat dinyalakan",Motherboard
"Monitor tidak menampilkan gambar meskipun komputer menyala",Graphic Card
"Komputer terlalu lambat saat digunakan untuk multitasking",Processor
"Setelah menginstal Windows, komputer tidak bisa mendeteksi hard disk",Hard Disk
"Monitor menampilkan layar biru setelah beberapa jam digunakan",Graphic Card
"Komputer mati mendadak saat browsing di internet",Power Supply
"Suara kipas sangat keras dan komputer sering restart",Power Supply
"Komputer tidak menyala setelah memasang power supply baru",Power Supply
"Komputer hang saat membuka file CAD berukuran besar",RAM
"Komputer restart setelah menjalankan aplikasi grafis",Power Supply
"Layar monitor menampilkan garis-garis setelah dihidupkan",Graphic Card
"Komputer tidak merespons setelah menjalankan program simulasi",RAM
"Monitor berkedip-kedip saat digunakan untuk bermain game",Graphic Card
"Komputer restart sendiri setelah menginstal driver motherboard",Motherboard
"Komputer hang saat melakukan pembaruan sistem",Processor
"Monitor menampilkan garis-garis saat menghidupkan komputer",Graphic Card
"PC tiba-tiba restart saat melakukan multitasking",RAM
"Komputer tidak bisa terhubung ke jaringan setelah di-reset",Motherboard
"Ada suara berdengung dari power supply saat dinyalakan",Power Supply
"Komputer berjalan lambat saat menjalankan aplikasi berat",RAM
"Monitor tidak menampilkan gambar meskipun semua kabel terhubung",Graphic Card
"Komputer tidak bisa booting setelah mengganti RAM",RAM
"USB port depan tidak berfungsi setelah diinstal ulang",Motherboard
"Komputer tidak merespons setelah dinyalakan, layar tetap hitam",Motherboard
"Setelah ganti CPU, komputer sering hang",Processor
"Komputer mati mendadak saat membuka aplikasi baru",Power Supply
"Monitor berkedip setiap kali komputer dihidupkan",Graphic Card
"Suara bising dari hard disk saat diakses",Hard Disk
"Komputer tidak mengenali hard disk eksternal yang terhubung",Hard Disk
"Komputer sering freeze saat bermain game berat",RAM
"Monitor tampak buram saat digunakan untuk browsing",Graphic Card
"Setiap kali menyalakan komputer, ada suara beep pendek",Motherboard
"Komputer tidak mau menyala setelah dipindahkan",Power Supply
"Hard disk tidak terdeteksi di BIOS setelah restart",Hard Disk
"Komputer lambat saat mengunduh file besar",Processor
"Monitor tidak merespons saat bermain game",Graphic Card
"Komputer sering reboot sendiri saat streaming video",Power Supply
"Setelah mengganti GPU, tampilan komputer menjadi buram",Graphic Card
"Suara bip panjang muncul saat booting, layar tetap hitam",Motherboard
"Komputer tidak bisa memuat sistem operasi setelah update",Hard Disk
"Monitor tiba-tiba gelap saat digunakan untuk gaming",Graphic Card
"PC hang saat memindahkan file ke hard disk eksternal",Hard Disk
"Komputer mengeluarkan suara klik saat dinyalakan",Hard Disk
"Komputer tidak bisa terhubung ke Wi-Fi setelah di-reset",Motherboard
"Monitor berkedip saat menjalankan aplikasi grafis",Graphic Card
"Komputer tidak mengenali perangkat USB setelah restart",Motherboard
"PC sering mati mendadak saat digunakan untuk rendering video",Processor
"Setiap kali dinyalakan, komputer mengeluarkan suara aneh",Motherboard
"Hard disk mengeluarkan suara berisik saat diakses",Hard Disk
"Komputer mati mendadak saat bermain game online",Power Supply
"Monitor tidak menampilkan gambar setelah ganti GPU",Graphic Card
"Komputer hang saat menginstal aplikasi baru",RAM
"Setiap kali menjalankan program, komputer sangat lambat",Processor
"Monitor hitam meski semua komponen lainnya menyala",Graphic Card
"PC terlalu panas setelah dipakai beberapa jam",Processor
"Komputer tidak bisa booting setelah mengganti motherboard",Motherboard
"Suara bip berulang saat dinyalakan, tidak ada tampilan",Motherboard
"Komputer sering restart sendiri saat menggunakan internet",RAM
"Monitor tidak menampilkan gambar meskipun komputer dihidupkan",Graphic Card
"Komputer berjalan lambat saat membuka aplikasi berat",RAM
"USB port belakang tidak berfungsi pada semua perangkat yang dicoba",Motherboard
"Komputer hang saat bermain game berat",RAM
"Monitor menampilkan garis-garis aneh saat dihidupkan",Graphic Card
"Komputer tiba-tiba mati saat digunakan untuk streaming",Power Supply
"Setelah mengganti hard disk, sistem tidak mau boot",Hard Disk
"Komputer freeze saat mengunduh file besar",RAM
"Monitor tidak memberikan tampilan apapun meski menyala",Graphic Card
"PC sangat lambat saat memindahkan data dari USB",RAM
"Komputer tidak mendeteksi RAM baru setelah upgrade",RAM
"Komputer mengeluarkan suara klik saat booting",Hard Disk
"Setiap kali dinyalakan, komputer mengeluarkan suara beep",Motherboard
"Komputer hang saat menjalankan program desain",RAM
"Monitor menunjukkan warna yang salah setelah dinyalakan",Graphic Card
"Komputer reboot sendiri saat menginstal aplikasi baru",Power Supply
"Monitor tidak berfungsi setelah dihidupkan",Graphic Card
"Komputer tidak bisa terhubung ke internet setelah restart",Motherboard
"PC mati mendadak saat bermain game online",Power Supply
"Setiap kali booting, komputer menunjukkan kesalahan BIOS",Motherboard
"Komputer hang saat membuka beberapa tab di browser",RAM
"Monitor tidak merespons saat dipakai untuk browsing",Graphic Card
"Komputer mati total saat memindahkan file besar",Power Supply
"Setelah upgrade RAM, komputer tidak mau booting",RAM
"Komputer tidak mendeteksi hard disk eksternal",Hard Disk
"Monitor sering berkedip saat digunakan untuk menonton film",Graphic Card
"PC hang saat mengubah pengaturan di BIOS",Motherboard
"Komputer tidak mau menyala meskipun sudah dicoba beberapa kali",Power Supply
"Hard disk tidak terdeteksi setelah restart",Hard Disk
"Monitor hitam meski semua kabel terhubung",Graphic Card
"Komputer sering restart saat memutar video",RAM
"Komputer freeze saat melakukan streaming video",RAM
"Monitor tidak menampilkan gambar setelah menghidupkan komputer",Graphic Card
"PC tidak mengenali GPU baru yang dipasang",Graphic Card
"Komputer mati mendadak saat melakukan multitasking",Power Supply
"Monitor berkedip setiap kali memutar video",Graphic Card
"Komputer tidak dapat memuat sistem operasi setelah penginstalan",Hard Disk
"PC hang saat membuka aplikasi grafis",RAM
"Setiap kali dinyalakan, ada suara beep panjang",Motherboard
"Komputer tidak terhubung ke jaringan setelah di-upgrade",Motherboard
"Monitor tidak memberikan tampilan setelah dinyalakan",Graphic Card
"Komputer berjalan lambat saat membuka banyak tab di browser",RAM
"PC mati mendadak saat digunakan untuk bermain game",Power Supply
"Hard disk mengeluarkan suara aneh saat diakses",Hard Disk
"Monitor menunjukkan garis-garis saat bermain game",Graphic Card
"Komputer tidak mengenali hard disk setelah upgrade",Hard Disk
"Komputer sering freeze saat menonton film",RAM
"Monitor tidak memberikan tampilan apapun meski komputer menyala",Graphic Card
"Komputer hang saat mencoba memutar video besar",RAM
"PC reboot sendiri saat membuka aplikasi baru",Power Supply
"Setiap kali booting, tampilan monitor kosong",Graphic Card
"Komputer lambat saat mengunduh file besar",Processor
"Monitor tidak menunjukkan gambar setelah ganti GPU",Graphic Card
"Komputer tidak bisa booting setelah mengganti hard disk",Hard Disk
"Komputer sering restart saat menggunakan aplikasi berat",RAM
"Monitor tidak berfungsi saat komputer dihidupkan",Graphic Card
"Komputer hang saat melakukan streaming video",RAM
"Setiap kali dinyalakan, suara beep panjang muncul",Motherboard
"Komputer mati mendadak saat menggunakan aplikasi desain",Processor
"Monitor hitam meski semua komponen menyala",Graphic Card
"Komputer tidak terhubung ke Wi-Fi setelah di-reset",Motherboard
"Komputer mengeluarkan suara berisik saat booting",Motherboard
"Hard disk tidak terdeteksi di sistem operasi setelah restart",Hard Disk
"PC sering mati mendadak saat bermain game online",Power Supply
"Monitor tidak menampilkan gambar saat dipakai untuk browsing",Graphic Card
"Komputer tidak bisa booting setelah install ulang OS",Hard Disk
"Setelah upgrade CPU, komputer tidak mau menyala",Motherboard
"Komputer tidak mendeteksi perangkat USB setelah restart",Motherboard
"Komputer sering freeze saat menggunakan aplikasi berat",RAM
"Monitor menunjukkan gambar buram saat digunakan",Graphic Card
"Komputer mati mendadak saat memindahkan file ke hard disk eksternal",Power Supply
"Komputer mengeluarkan suara klik-klik dari hard disk",Hard Disk
"PC sangat lambat saat melakukan transfer data",RAM
"Monitor tidak memberikan tampilan meski komputer menyala",Graphic Card
"Komputer tidak bisa booting setelah mengganti GPU",Graphic Card
"Monitor hitam meski semua komponen menyala normal",Graphic Card
"Komputer hang saat membuka aplikasi berat",RAM
"Komputer sering restart saat streaming video",Power Supply
"Komputer tidak mengenali hard disk setelah di-upgrade",Hard Disk
"Komputer tidak bisa terhubung ke jaringan setelah restart",Motherboard
"Monitor tidak memberikan tampilan meski komputer sudah dihidupkan",Graphic Card
"Komputer hang saat mengunduh file besar",RAM
"Setiap kali booting, ada suara beep pendek",Motherboard
"Komputer tidak terhubung ke Wi-Fi setelah upgrade",Motherboard
"Monitor menampilkan gambar buram saat browsing",Graphic Card
"Komputer sering reboot sendiri saat multitasking",Power Supply
"Monitor tidak menampilkan gambar setelah dinyalakan",Graphic Card
"Komputer tidak bisa booting setelah upgrade CPU",Motherboard
"Setiap kali menjalankan aplikasi berat, komputer sering freeze",RAM
"Komputer lambat saat melakukan streaming video",Processor
"Monitor menunjukkan garis-garis saat bermain game",Graphic Card
