description,component
"PC tidak mengenali GPU baru setelah diinstal",Graphic Card
"Komputer mati mendadak saat digunakan untuk browsing",Power Supply
"Monitor tidak menampilkan gambar saat digunakan untuk menonton video",Graphic Card
"Komputer hang saat menjalankan aplikasi editing",RAM
"Setelah mengganti motherboard, komputer tidak mau menyala",Motherboard
"Komputer tidak terhubung ke jaringan setelah di-reset",Motherboard
"Monitor berkedip setiap kali komputer dinyalakan",Graphic Card
"Komputer hang saat menggunakan aplikasi desain",RAM
"Monitor menampilkan garis-garis aneh saat dihidupkan",Graphic Card
"Komputer mati mendadak saat memutar video",Power Supply
"PC tidak mengenali hard disk eksternal yang terhubung",Hard Disk
"Komputer sering reboot sendiri saat streaming video",Power Supply
"Komputer hang saat menginstal aplikasi baru",RAM
"Monitor tidak memberikan tampilan meskipun komputer menyala",Graphic Card
"Komputer sering restart sendiri saat menggunakan internet",RAM
"Monitor menunjukkan warna yang salah saat digunakan",Graphic Card
"PC sering mati mendadak saat bermain game",Power Supply
"Komputer tidak bisa booting setelah install ulang sistem operasi",Hard Disk
"Monitor hitam meski semua komponen menyala",Graphic Card
"Komputer hang saat mengubah pengaturan di BIOS",Motherboard
"Komputer tidak mengenali RAM baru setelah upgrade",RAM
"Komputer tidak bisa terhubung ke internet setelah di-upgrade",Motherboard
"Monitor berkedip saat bermain game",Graphic Card
"Komputer tidak bisa booting setelah upgrade hard disk",Hard Disk
"Monitor tidak menampilkan gambar saat dinyalakan",Graphic Card
"PC sangat lambat saat membuka aplikasi desain grafis",RAM
"Setiap kali dinyalakan, ada suara beep berulang",Motherboard
"Komputer sering mati mendadak saat streaming",Power Supply
"Komputer tidak terhubung ke Wi-Fi setelah restart",Motherboard
"Komputer tidak bisa booting setelah mengganti GPU",Graphic Card
"Monitor menunjukkan garis-garis saat digunakan untuk menonton video",Graphic Card
"Komputer sering freeze saat menggunakan aplikasi berat",RAM
"PC tidak mengenali hard disk baru setelah diinstal",Hard Disk
"Monitor tidak memberikan tampilan setelah dihidupkan",Graphic Card
"Komputer mati mendadak saat digunakan untuk multitasking",Power Supply
"Monitor hitam meski semua komponen menyala normal",Graphic Card
"Komputer hang saat mengunduh file besar",RAM
"Komputer tidak bisa booting setelah mengganti motherboard",Motherboard
"Monitor menampilkan warna yang salah saat dipakai untuk browsing",Graphic Card
"PC mati mendadak saat bermain game online",Power Supply
"Hard disk mengeluarkan suara berisik saat diakses",Hard Disk
"Komputer sering restart saat menonton film",RAM
"Monitor tidak menampilkan gambar saat digunakan untuk browsing",Graphic Card
"Komputer hang saat membuka banyak tab di browser",RAM
"Setiap kali booting, ada suara beep panjang",Motherboard
"Komputer tidak terhubung ke jaringan setelah di-upgrade",Motherboard
"Monitor menunjukkan gambar buram saat digunakan",Graphic Card
"Komputer mati mendadak saat memindahkan file besar",Power Supply
"PC sangat lambat saat melakukan transfer data",RAM
"Monitor tidak memberikan tampilan meski komputer menyala",Graphic Card
"Komputer tidak bisa booting setelah install ulang OS",Hard Disk
"Setelah upgrade CPU, komputer tidak mau menyala",Motherboard
"Komputer tidak mendeteksi perangkat USB setelah restart",Motherboard
"Komputer sering freeze saat menggunakan aplikasi berat",RAM
"Monitor menunjukkan gambar buram saat browsing",Graphic Card
"Komputer mati mendadak saat melakukan streaming video",Power Supply
"Komputer mengeluarkan suara berisik saat booting",Motherboard
"Hard disk tidak terdeteksi di sistem operasi setelah restart",Hard Disk
"PC sering mati mendadak saat bermain game online",Power Supply
"Monitor tidak menampilkan gambar saat dipakai untuk browsing",Graphic Card
"Komputer tidak bisa booting setelah upgrade CPU",Motherboard
"Setiap kali menjalankan aplikasi berat, komputer sering freeze",RAM
"Komputer lambat saat melakukan streaming video",Processor
"Monitor menunjukkan garis-garis saat bermain game",Graphic Card
"Komputer hang saat mengubah pengaturan di BIOS",Motherboard
"Komputer tidak mengenali USB drive setelah dihubungkan",Motherboard
"Monitor tidak memberikan tampilan saat komputer dinyalakan",Graphic Card
"PC sering mati mendadak saat browsing",Power Supply
"Hard disk mengeluarkan suara aneh saat diakses",Hard Disk
"Komputer tidak bisa booting setelah ganti motherboard",Motherboard
"Komputer tidak terhubung ke jaringan setelah di-upgrade",Motherboard
"Monitor hitam meski semua komponen menyala",Graphic Card
"Komputer sering restart saat menggunakan aplikasi grafis",RAM
"Komputer tidak bisa terhubung ke Wi-Fi setelah restart",Motherboard
"Setiap kali dinyalakan, ada suara beep berulang",Motherboard
"Komputer tidak bisa booting setelah mengganti hard disk",Hard Disk
"Monitor menunjukkan garis-garis saat menonton film",Graphic Card
"Komputer freeze saat mengunduh file besar",RAM
"PC tidak mengenali GPU baru setelah diinstal",Graphic Card
"Komputer mati mendadak saat digunakan untuk browsing",Power Supply
"Monitor tidak menampilkan gambar saat digunakan untuk menonton video",Graphic Card
"Komputer hang saat menjalankan aplikasi editing",RAM
"Setelah mengganti motherboard, komputer tidak mau menyala",Motherboard
"Komputer tidak terhubung ke jaringan setelah di-reset",Motherboard
"Monitor berkedip setiap kali komputer dinyalakan",Graphic Card
"Komputer hang saat menggunakan aplikasi desain",RAM
"Monitor menampilkan garis-garis aneh saat dihidupkan",Graphic Card
"Komputer mati mendadak saat memutar video",Power Supply
"PC tidak mengenali hard disk eksternal yang terhubung",Hard Disk
"Komputer sering reboot sendiri saat streaming video",Power Supply
"Komputer hang saat menginstal aplikasi baru",RAM
"Monitor tidak memberikan tampilan meskipun komputer menyala",Graphic Card
"Komputer sering restart sendiri saat menggunakan internet",RAM
"Monitor menunjukkan warna yang salah saat digunakan",Graphic Card
"PC sering mati mendadak saat bermain game",Power Supply
"Komputer tidak bisa booting setelah install ulang sistem operasi",Hard Disk
"Monitor hitam meski semua komponen menyala",Graphic Card
"Komputer hang saat mengubah pengaturan di BIOS",Motherboard
"Komputer tidak mengenali RAM baru setelah upgrade",RAM
"Komputer tidak bisa terhubung ke internet setelah di-upgrade",Motherboard
"Monitor berkedip saat bermain game",Graphic Card
"Komputer tidak bisa booting setelah upgrade hard disk",Hard Disk
"Monitor tidak menampilkan gambar saat dinyalakan",Graphic Card
"PC sangat lambat saat membuka aplikasi desain grafis",RAM
"Setiap kali dinyalakan, ada suara beep berulang",Motherboard
"Komputer sering mati mendadak saat streaming",Power Supply
"Komputer tidak terhubung ke Wi-Fi setelah restart",Motherboard
"Komputer tidak bisa booting setelah mengganti GPU",Graphic Card
"Monitor menunjukkan garis-garis saat digunakan untuk menonton video",Graphic Card
"Komputer sering freeze saat menggunakan aplikasi berat",RAM
"Komputer tiba-tiba restart sendiri saat sedang bermain game",Power Supply
"Setelah update driver, monitor tidak menampilkan gambar",Graphic Card
"Komputer sering freeze saat menjalankan banyak program sekaligus",RAM
"BIOS menampilkan pesan error dan tidak bisa masuk ke sistem",Motherboard
"Prosesor overheating meskipun sudah menggunakan kipas pendingin",Processor
"Hard disk tidak terbaca meskipun sudah dipindahkan ke slot lain",Hard Disk
"Komputer mengeluarkan suara bising dari power supply",Power Supply
"Setelah menambah RAM, komputer tidak mau menyala",RAM
"Monitor menampilkan artefak saat rendering video",Graphic Card
"USB belakang tidak mendeteksi perangkat eksternal",Motherboard
"Komputer hang saat menjalankan aplikasi berat dalam waktu lama",Processor
"Hard disk sering gagal dalam membaca data",Hard Disk
"Komputer tiba-tiba mati saat menjalankan aplikasi grafis tinggi",Power Supply
"Setelah diinstal ulang, komputer menjadi sangat lambat",RAM
"Monitor kehilangan sinyal secara acak",Graphic Card
"Motherboard mengeluarkan bunyi beep berulang kali saat dinyalakan",Motherboard
"Komputer tidak bisa mendeteksi RAM yang baru dipasang",RAM
"Hard disk mengeluarkan suara aneh dan data tidak terbaca",Hard Disk
"Komputer sering mati tanpa peringatan setelah beberapa jam digunakan",Power Supply
"Monitor menunjukkan garis vertikal saat menampilkan gambar",Graphic Card
"Prosesor cepat panas saat digunakan untuk rendering video",Processor
"Komputer tidak merespons saat membuka program berat",Processor
"Prosesor sering overheat saat digunakan untuk bermain game",Processor
"Performa prosesor menurun setelah beberapa menit penggunaan",Processor
"Fan CPU berputar kencang namun prosesor tetap overheat",Processor
"Komputer crash saat membuka aplikasi grafis",Processor
"Prosesor tidak mendeteksi dengan benar saat di BIOS",Processor
"CPU usage mencapai 100% meskipun hanya membuka satu aplikasi",Processor
"Komputer melambat saat menjalankan aplikasi editing video",Processor
"Prosesor cepat sekali panas bahkan dengan cooling system",Processor
"Prosesor stuck di clock speed rendah setelah di-update",Processor
"Saat multitasking, komputer sering freeze atau hang",Processor
"Prosesor tidak bekerja optimal setelah overclocking",Processor
"Komputer restart sendiri saat CPU mencapai 80 derajat",Processor
"Prosesor tidak bekerja saat booting, hanya ada suara beep",Processor
"Komputer melambat saat menjalankan beberapa aplikasi secara bersamaan",Processor
"Prosesor sering mengalami throttling meski beban kerja rendah",Processor
"CPU fan tidak berputar meski prosesor overheat",Processor
"Setelah update BIOS, prosesor sering tidak responsif",Processor
"Prosesor berfungsi lambat meski indikator CPU rendah",Processor
"Prosesor tidak kompatibel dengan motherboard baru",Processor
"Komputer mati sendiri saat suhu CPU naik",Processor
"Prosesor gagal mendeteksi semua core",Processor
"Komputer hanya booting setelah beberapa kali restart",Processor
"Prosesor tidak bekerja optimal saat menjalankan game",Processor
"Saat rendering, komputer tiba-tiba hang",Processor
"Komputer freeze saat membuka aplikasi desain",Processor
"Prosesor tidak bisa mempertahankan suhu stabil",Processor
"Fan CPU berputar kencang, tapi suhu prosesor tetap tinggi",Processor
"Prosesor bekerja lambat meskipun tidak ada banyak aplikasi",Processor
"Komputer lag setiap kali membuka program berat",Processor
"Prosesor tiba-tiba overheat saat membuka aplikasi sederhana",Processor
"Komputer tiba-tiba hang saat menjalankan beberapa aplikasi",Processor
"Prosesor tidak kompatibel dengan driver terbaru",Processor
"Komputer tiba-tiba mati setelah suhu prosesor mencapai batas",Processor
"Prosesor sering tidak terdeteksi saat booting",Processor
"Komputer terlalu lama booting karena prosesor",Processor
"Prosesor selalu mencapai suhu tinggi meskipun baru digunakan",Processor
"Komputer freeze ketika CPU mencapai 100%",Processor
"Prosesor tidak merespons saat membuka banyak program",Processor
"Komputer lambat saat membuka browser",Processor
"Prosesor sering mengalami throttling tanpa sebab",Processor
"Komputer restart tiba-tiba saat CPU digunakan penuh",Processor
"Prosesor melambat saat multitasking",Processor
"Prosesor berfungsi sangat lambat setelah melakukan update",Processor
"Komputer tiba-tiba hang saat menjalankan aplikasi coding",Processor
"CPU fan tidak berjalan meski suhu prosesor naik",Processor
"Prosesor berhenti merespons saat menjalankan aplikasi berat",Processor
"Setelah update BIOS, prosesor tidak terdeteksi",Processor
"Prosesor melambat saat membuka software video editing",Processor
"Komputer selalu hang saat menjalankan game",Processor
"Prosesor cepat panas bahkan saat idle",Processor
"Komputer lambat setelah prosesor dipasang",Processor
"Prosesor terlalu panas saat digunakan untuk komputasi berat",Processor
"Komputer mati sendiri saat prosesor mencapai batas suhu",Processor
"Prosesor berhenti merespons saat menjalankan aplikasi simulasi",Processor
"Prosesor tidak merespons setelah di-overclock",Processor
"Komputer lambat setiap kali membuka aplikasi grafis",Processor
"Hard disk tiba-tiba tidak terdeteksi di BIOS",Hard Disk
"Komputer tidak bisa boot karena hard disk tidak terdeteksi",Hard Disk
"Hard disk mengeluarkan suara klik berulang saat diakses",Hard Disk
"Hard disk gagal melakukan proses booting dengan normal",Hard Disk
"Setelah restart, hard disk tidak terbaca sama sekali",Hard Disk
"Hard disk sering mengalami corrupt data",Hard Disk
"Hard disk melambat saat menyalin file berukuran besar",Hard Disk
"Hard disk mengeluarkan suara aneh saat diakses",Hard Disk
"Komputer sering crash saat mencoba mengakses hard disk",Hard Disk
"Hard disk sering freeze saat digunakan",Hard Disk
"Hard disk tidak terbaca setelah komputer dinyalakan",Hard Disk
"Komputer sering hang saat mengakses file di hard disk",Hard Disk
"Hard disk mengeluarkan suara keras saat digunakan",Hard Disk
"Hard disk tidak bisa menulis data dengan benar",Hard Disk
"Komputer gagal boot karena hard disk corrupt",Hard Disk
"Hard disk tidak merespons saat menyalin file besar",Hard Disk
"Setelah restart, data di hard disk tidak bisa diakses",Hard Disk
"Hard disk tiba-tiba menghilang dari sistem operasi",Hard Disk
"Hard disk mengeluarkan bunyi bising terus menerus",Hard Disk
"Hard disk corrupt setelah komputer crash",Hard Disk
"Komputer sering freeze saat mengakses hard disk",Hard Disk
"Hard disk tidak bisa terbaca setelah komputer restart",Hard Disk
"Data di hard disk tidak bisa dibaca oleh sistem",Hard Disk
"Hard disk tiba-tiba mengeluarkan suara klik terus menerus",Hard Disk
"Komputer tidak bisa mendeteksi hard disk baru",Hard Disk
"Hard disk gagal menulis data dengan benar",Hard Disk
"Hard disk mengeluarkan suara mendengung saat digunakan",Hard Disk
"Komputer crash saat membuka file dari hard disk",Hard Disk
"Hard disk tidak bisa diakses setelah crash mendadak",Hard Disk
"Komputer sering hang saat booting dari hard disk",Hard Disk
"komputer saya overheat.",Fan Cooler
"kipas di prosesor saya mati.",Fan Cooler
"komputer menjadi panas saat digunakan.",Fan Cooler
"kipas CPU tidak berputar.",Fan Cooler
"suara kipas komputer sangat bising.",Fan Cooler
"komputer mati mendadak setelah beberapa waktu.",Fan Cooler
"kipas casing berhenti berfungsi.",Fan Cooler
"komputer terlalu panas saat bermain game.",Fan Cooler
"kipas laptop berhenti bekerja.",Fan Cooler
"komputer terlalu panas meskipun hanya digunakan untuk browsing.",Fan Cooler
"kipas CPU sangat lambat berputar.",Fan Cooler
"komputer saya cepat panas walau tidak melakukan aktivitas berat.",Fan Cooler
"kipas pendingin CPU rusak.",Fan Cooler
"komputer terasa panas meski ruangan dingin.",Fan Cooler
"kipas komputer mengeluarkan suara aneh.",Fan Cooler
"kipas prosesor tidak bekerja saat booting.",Fan Cooler
"komputer cepat panas walau baru dinyalakan.",Fan Cooler
"suara kipas terdengar sangat keras.",Fan Cooler
"komputer mati karena overheat.",Fan Cooler
"komputer saya selalu overheat saat digunakan.",Fan Cooler
"kipas CPU tidak berfungsi dengan baik.",Fan Cooler
"kipas laptop tidak berputar sama sekali.",Fan Cooler
"komputer terlalu panas ketika digunakan untuk render video.",Fan Cooler
"kipas casing tidak bekerja.",Fan Cooler
"komputer mati setelah kipas berhenti.",Fan Cooler
"suara kipas sangat bising saat komputer bekerja keras.",Fan Cooler
"kipas prosesor tidak menyala.",Fan Cooler
"komputer saya cepat panas walau tidak bermain game.",Fan Cooler
"kipas tidak bekerja dengan baik, menyebabkan komputer overheat.",Fan Cooler
"komputer sering mati karena panas berlebih.",Fan Cooler
"komputer cepat panas, bahkan saat hanya menonton video.",Fan Cooler
"kipas prosesor berputar lambat.",Fan Cooler
"komputer panas setelah kipas berhenti.",Fan Cooler
"suara kipas semakin keras saat komputer dipakai.",Fan Cooler
"kipas CPU tidak bekerja setelah komputer dinyalakan.",Fan Cooler
"komputer sering mengalami overheat karena kipas tidak bekerja.",Fan Cooler
"suara kipas semakin bising saat digunakan untuk gaming.",Fan Cooler
"kipas komputer berhenti bekerja.",Fan Cooler
"komputer terlalu panas bahkan saat idle.",Fan Cooler
"kipas casing sangat lambat.",Fan Cooler
"komputer tiba-tiba mati karena kipas tidak berfungsi.",Fan Cooler
"kipas CPU rusak menyebabkan komputer overheat.",Fan Cooler
"suara kipas sangat keras dan bising.",Fan Cooler
"komputer cepat panas meskipun kipas sudah dibersihkan.",Fan Cooler
"kipas prosesor rusak menyebabkan komputer panas.",Fan Cooler
"suara kipas semakin keras seiring dengan penggunaan komputer.",Fan Cooler
"kipas CPU mati saat komputer menyala.",Fan Cooler
"komputer sering mati karena suhu terlalu tinggi.",Fan Cooler
"komputer overheat saat digunakan untuk mengedit video.",Fan Cooler
"kipas komputer tidak berjalan.",Fan Cooler
"komputer terlalu panas meski hanya browsing internet.",Fan Cooler
"suara kipas semakin keras saat menjalankan program berat.",Fan Cooler
"kipas laptop tidak menyala saat komputer dihidupkan.",Fan Cooler
"komputer mati setelah kipas berhenti bekerja.",Fan Cooler
"komputer terasa panas dan kipas tidak berfungsi.",Fan Cooler
"suara kipas semakin bising saat komputer menyala.",Fan Cooler
"kipas prosesor lambat berputar.",Fan Cooler
"komputer saya overheat setelah beberapa menit penggunaan.",Fan Cooler
"kipas komputer tidak bekerja dengan baik.",Fan Cooler
"suara kipas sangat bising saat komputer digunakan untuk bekerja berat.",Fan Cooler
"kipas CPU tidak berputar dengan kecepatan yang seharusnya.",Fan Cooler
"komputer cepat panas karena kipas rusak.",Fan Cooler
"suara kipas terdengar seperti gesekan.",Fan Cooler
"kipas laptop lambat berputar.",Fan Cooler
"komputer mati tiba-tiba setelah kipas berhenti berputar.",Fan Cooler
"komputer saya sangat cepat panas meskipun baru dinyalakan.",Fan Cooler
"kipas prosesor tidak bekerja dengan baik.",Fan Cooler
"komputer terlalu panas setelah beberapa jam penggunaan.",Fan Cooler
"suara kipas terdengar keras dan aneh.",Fan Cooler
"kipas CPU tidak berfungsi, menyebabkan komputer terlalu panas.",Fan Cooler
"komputer mati setelah kipas berhenti berfungsi.",Fan Cooler
"komputer cepat panas saat digunakan untuk bermain game.",Fan Cooler
"kipas laptop tidak berputar sama sekali.",Fan Cooler
"komputer overheat saat menjalankan aplikasi berat.",Fan Cooler
"komputer tiba-tiba mati karena kipas terlalu lambat.",Fan Cooler
"suara kipas sangat kencang saat startup.",Fan Cooler
"komputer terlalu panas meski baru dinyalakan sebentar.",Fan Cooler
"kipas CPU tidak menyala setelah membersihkan debu.",Fan Cooler
"komputer mengalami overheat saat rendering video.",Fan Cooler
"kipas pendingin laptop tidak berfungsi sama sekali.",Fan Cooler
"komputer cepat panas walau suhu ruangan dingin.",Fan Cooler
"suara kipas komputer sangat berisik saat digunakan.",Fan Cooler
"komputer mati karena kipas tidak berjalan dengan baik.",Fan Cooler
"kipas casing tidak berputar setelah beberapa jam.",Fan Cooler
"komputer tiba-tiba mati saat kipas tidak berfungsi.",Fan Cooler
"suara kipas laptop semakin keras saat bermain game.",Fan Cooler
"kipas CPU berhenti berputar saat komputer panas.",Fan Cooler
"komputer terasa panas meskipun kipas sudah menyala.",Fan Cooler
"komputer terlalu panas ketika menjalankan aplikasi berat.",Fan Cooler
"suara kipas semakin bising setiap kali saya menggunakan komputer.",Fan Cooler
"kipas komputer tidak bekerja setelah pemakaian lama.",Fan Cooler
"komputer sering mati mendadak karena panas berlebih.",Fan Cooler
"suara kipas sangat pelan, hampir tidak terdengar.",Fan Cooler
"kipas laptop mati saat digunakan untuk waktu lama.",Fan Cooler
"motherboard tidak bisa mendeteksi hard drive.",Motherboard
"komputer saya tidak mau menyala, hanya lampu indikator menyala.",Motherboard
"motherboard saya mengalami korsleting.",Motherboard
"komputer tidak bisa booting, mungkin masalah di motherboard.",Motherboard
"port USB di motherboard tidak berfungsi.",Motherboard
"motherboard tidak mengeluarkan suara beep saat dinyalakan.",Motherboard
"slot RAM di motherboard tidak berfungsi.",Motherboard
"komputer sering hang, mungkin karena motherboard bermasalah.",Motherboard
"komputer tidak bisa menyala setelah mengganti motherboard.",Motherboard
"komputer tiba-tiba mati, sepertinya motherboard rusak.",Motherboard
"motherboard tidak dapat mendeteksi VGA card.",Motherboard
"laptop tidak mau menyala, motherboard rusak.",Motherboard
"komputer tidak dapat booting, motherboard tidak terdeteksi.",Motherboard
"suara beep terus-menerus setelah motherboard dinyalakan.",Motherboard
"motherboard tidak mengeluarkan sinyal ke monitor.",Motherboard
"motherboard laptop saya rusak setelah terkena air.",Motherboard
"motherboard tidak dapat mengeluarkan suara beep saat ada masalah.",Motherboard
"komputer freeze di tengah penggunaan, motherboard bermasalah.",Motherboard
"komputer restart terus-menerus, masalah di motherboard.",Motherboard
"slot PCIe di motherboard rusak.",Motherboard
"komputer saya sering hang, mungkin RAM bermasalah.",RAM
"komputer saya restart terus-menerus, RAM mungkin rusak.",RAM
"komputer tidak menyala setelah saya mengganti RAM.",RAM
"komputer sering blue screen, mungkin masalah RAM.",RAM
"RAM tidak terdeteksi oleh sistem.",RAM
"komputer sering restart tiba-tiba, mungkin karena RAM bermasalah.",RAM
"komputer menjadi sangat lambat setelah saya menambah RAM.",RAM
"komputer tidak bisa booting setelah saya memasang RAM baru.",RAM
"slot RAM di motherboard tidak dapat mendeteksi RAM.",RAM
"komputer tidak menyala setelah saya meng-upgrade RAM.",RAM
"RAM mengeluarkan suara beep terus-menerus.",RAM
"komputer tidak bisa booting, RAM rusak.",RAM
"komputer sering crash saat menjalankan aplikasi berat.",RAM
"komputer tidak stabil setelah saya menambah RAM.",RAM
"RAM tidak kompatibel dengan motherboard.",RAM
"komputer lambat setelah RAM baru dipasang.",RAM
"RAM tidak terdeteksi setelah dipasang di slot yang berbeda.",RAM
"komputer menjadi sangat lambat saat multitasking, mungkin karena RAM.",RAM
"komputer tidak bisa membaca seluruh kapasitas RAM yang terpasang.",RAM
"komputer sering hang setelah RAM ditambahkan.",RAM
"RAM saya rusak, menyebabkan komputer sering restart.",RAM
"komputer sering freeze saat menjalankan aplikasi, masalah RAM.",RAM
"RAM tidak terbaca setelah dipindahkan ke slot lain.",RAM
"komputer saya lambat sekali, RAM mungkin perlu diganti.",RAM
"komputer mati setelah beberapa menit, mungkin RAM bermasalah.",RAM
"RAM laptop saya rusak setelah upgrade.",RAM
"komputer sering restart sendiri saat menjalankan program besar.",RAM
"RAM saya tidak terdeteksi setelah dibersihkan.",RAM
"komputer tidak bisa menyala setelah menambah RAM baru.",RAM
"komputer menjadi lambat setelah upgrade RAM.",RAM
"komputer saya tiba-tiba mati total.",Power Supply
"power supply mengeluarkan suara berdengung.",Power Supply
"komputer tidak menyala setelah saya mengganti power supply.",Power Supply
"power supply sering overheat.",Power Supply
"komputer sering restart sendiri, mungkin karena power supply.",Power Supply
"suara kipas di power supply sangat bising.",Power Supply
"power supply tidak mengirimkan daya ke motherboard.",Power Supply
"lampu indikator power supply berkedip terus.",Power Supply
"komputer mati mendadak saat digunakan untuk waktu lama.",Power Supply
"power supply laptop saya tidak mengisi daya.",Power Supply
"power supply mengeluarkan bau terbakar.",Power Supply
"komputer tidak menyala setelah listrik mati.",Power Supply
"power supply tidak bisa mengalirkan listrik dengan stabil.",Power Supply
"kipas di power supply berhenti berputar.",Power Supply
"komputer hanya menyala sebentar, lalu mati.",Power Supply
"power supply tidak berfungsi setelah listrik turun.",Power Supply
"komputer tidak bisa booting, power supply rusak.",Power Supply
"lampu power supply tidak menyala sama sekali.",Power Supply
"komputer sering tiba-tiba mati, masalah power supply.",Power Supply
"power supply mengeluarkan suara keras.",Power Supply
"komputer mati setelah beberapa menit, power supply overheat.",Power Supply
"power supply tidak bisa memberikan daya ke perangkat lain.",Power Supply
"komputer tidak dapat dihidupkan setelah power supply diganti.",Power Supply
"power supply sering menyebabkan komputer hang.",Power Supply
"power supply terlalu panas dan mengeluarkan suara.",Power Supply
"komputer tidak menyala setelah power supply terkena air.",Power Supply
"power supply tidak bisa mengirimkan daya ke GPU.",Power Supply
"komputer saya tidak mau nyala, hanya lampu power yang menyala.",Power Supply
"power supply mengeluarkan suara keras seperti kipas rusak.",Power Supply
"power supply sering menyebabkan komputer restart sendiri.",Power Supply
"hard disk saya mengeluarkan suara klik-klik.",Hard Disk
"komputer tidak bisa mendeteksi hard disk.",Hard Disk
"hard disk saya sangat lambat saat membuka file.",Hard Disk
"komputer sering freeze saat hard disk bekerja.",Hard Disk
"data di hard disk tiba-tiba hilang.",Hard Disk
"hard disk tidak terbaca oleh sistem.",Hard Disk
"hard disk eksternal tidak bisa diakses.",Hard Disk
"komputer saya sering hang saat hard disk sedang digunakan.",Hard Disk
"hard disk mengeluarkan suara berisik saat berputar.",Hard Disk
"komputer tidak bisa booting karena hard disk tidak terdeteksi.",Hard Disk
"hard disk saya penuh, tapi saya tidak menyimpan banyak data.",Hard Disk
"kecepatan transfer data di hard disk sangat lambat.",Hard Disk
"komputer tidak mau menyala setelah saya pasang hard disk baru.",Hard Disk
"file di hard disk tidak bisa diakses, sepertinya corrupt.",Hard Disk
"hard disk saya terlalu lambat saat menyalin file.",Hard Disk
"komputer sering restart sendiri karena hard disk bermasalah.",Hard Disk
"hard disk eksternal terputus sendiri saat digunakan.",Hard Disk
"hard disk tidak bisa di format, selalu gagal.",Hard Disk
"hard disk mengeluarkan suara aneh seperti gesekan.",Hard Disk
"komputer tidak bisa membaca hard disk setelah dipindahkan.",Hard Disk
