description,component
"komputer sering restart, mungkin masalah di motherboard.",Motherboard
"port HDMI di motherboard tidak berfungsi.",Motherboard
"motherboard tidak bisa mendeteksi perangkat USB.",Motherboard
"komputer tidak mengeluarkan suara beep saat dinyalakan.",Motherboard
"motherboard tidak mengenali SSD yang terpasang.",Motherboard
"komputer tidak menyala setelah saya mengganti baterai CMOS di motherboard.",Motherboard
"komputer saya tiba-tiba mati, mungkin motherboard bermasalah.",Motherboard
"motherboard mengalami korsleting setelah terkena air.",Motherboard
"komputer tidak bisa booting, motherboard rusak.",Motherboard
"slot RAM di motherboard tidak bisa membaca RAM baru.",Motherboard
"komputer saya lemot, mungkin prosesor sudah tua.",Processor
"komputer sering panas saat prosesor bekerja berat.",Processor
"prosesor tidak terdeteksi oleh motherboard.",Processor
"komputer sering hang saat menjalankan program berat, mungkin prosesor bermasalah.",Processor
"prosesor saya overheat saat digunakan untuk render video.",Processor
"komputer sering mati mendadak, masalah pada prosesor.",Processor
"prosesor tidak bekerja dengan baik setelah komputer overheat.",Processor
"komputer tidak menyala setelah saya mengganti prosesor.",Processor
"prosesor saya terlalu panas meskipun kipas sudah bersih.",Processor
"prosesor sering membuat komputer restart sendiri.",Processor
"kipas CPU berhenti berputar setelah beberapa menit.",Fan Cooler
"suara kipas sangat bising saat saya menggunakan komputer.",Fan Cooler
"kipas pendingin prosesor tidak berfungsi dengan baik.",Fan Cooler
"komputer cepat panas walaupun kipas sudah dibersihkan.",Fan Cooler
"kipas komputer mengeluarkan suara aneh saat berputar.",Fan Cooler
"komputer sering overheat, mungkin kipas rusak.",Fan Cooler
"kipas CPU tidak bekerja maksimal, menyebabkan overheat.",Fan Cooler
"suara kipas casing sangat keras.",Fan Cooler
"komputer mati mendadak karena kipas berhenti bekerja.",Fan Cooler
"kipas laptop saya tidak bekerja dengan baik.",Fan Cooler
"PC nyala tapi gak ada tampilan di layar, layar gelap total",Motherboard
"Komputer menyala tapi monitor tidak menampilkan apapun",Motherboard
"Nyala sih komputernya, tapi gak ada respon dari layar, mungkin motherboard-nya",Motherboard
"Layar tetap gelap walaupun komputer sudah dinyalakan, suara 'bip' juga tidak ada",Motherboard
"Pas nyalain komputer, gak ada tampilan sama sekali, padahal kipas jalan",Motherboard
"Monitor gak nangkep sinyal dari komputer, udah cek kabel, mungkin ada masalah di motherboard",Motherboard
"PC-nya hidup tapi layar blank, setelah upgrade RAM kok jadi begini ya?",RAM
"Baru ganti RAM, tapi sekarang gak ada tampilan di monitor waktu nyalain komputer",RAM
"Komputer nyala tapi gak ada display, RAM kayaknya gak ke-detect",RAM
"Layar tetap hitam setelah RAM baru dipasang, mungkin masalah di RAM atau slotnya",RAM
"Udah nyalain PC, tapi layarnya gak nyala, kemungkinan besar RAM-nya gak berfungsi",RAM
"Komputer udah nyala, tapi gak ada tampilan di layar, cuma gelap aja",Motherboard
"Monitor gak detect apapun walaupun PC udah hidup, kemungkinan motherboard-nya error",Motherboard
"Udah nyalain komputer tapi monitor gak nyala, mungkin ada masalah di motherboard",Motherboard
"Komputer hidup, tapi gak ada respon di layar, motherboard mungkin bermasalah",Motherboard
"Nyala, tapi gak masuk ke sistem, layar gelap terus, udah cek VGA dan kabel, mungkin motherboard",Motherboard
"PC jalan tapi gak ada display sama sekali, gak masuk ke BIOS juga",Motherboard
"Komputer kedengeran hidup, tapi gak ada tampilan di monitor, motherboard bisa jadi penyebabnya",Motherboard
"Pas dihidupin cuma kipas yang jalan, gak ada tampilan di layar, mungkin motherboard rusak",Motherboard
"Monitor gak nyala sama sekali setelah komputer dinyalakan, gak ada suara beep juga",Motherboard
"Komputer hidup tapi gak ada gambar di layar, motherboard atau power supply mungkin bermasalah",Motherboard
"Komputer lambat banget, tiap buka file kayaknya lama banget, hard disk mungkin bermasalah",Hard Disk
"File suka lama terbuka dan loading terus, mungkin hard disk-nya udah mau rusak",Hard Disk
"Komputer tiba-tiba lemot dan file suka corrupt, hard disk kayaknya udah lemah",Hard Disk
"Setiap kali akses file besar, komputer jadi lemot banget, kemungkinan hard disk udah tua",Hard Disk
"PC jadi sangat lambat dan suka nge-freeze, sepertinya masalah ada di hard disk",Hard Disk
"Komputer sering hang waktu transfer file besar, mungkin hard disk udah gak sanggup lagi",Hard Disk
"Lemot banget tiap kali ngeakses file atau aplikasi, kayaknya hard disk-nya harus diganti",Hard Disk
"Komputer sering freeze mendadak, apalagi kalau nge-copy file, kemungkinan hard disk udah bermasalah",Hard Disk
"PC jadi lambat banget setelah beberapa menit, tiap kali buka folder, loading terus, mungkin hard disk",Hard Disk
"Komputer suka lambat waktu akses file, hard disk sering bunyi aneh juga",Hard Disk
"Komputer suka lag tiba-tiba pas lagi main game, power supply kayaknya gak kuat",Power Supply
"PC sering lambat waktu nyalain aplikasi berat, mungkin power supply udah lemah",Power Supply
"Komputer mulai lag parah setelah dipakai lama, power supply-nya mungkin gak stabil",Power Supply
"Tiap kali buka aplikasi berat, komputer langsung lag, kemungkinan power supply gak bisa nyuplai daya dengan baik",Power Supply
"Komputer tiba-tiba lag pas lagi browsing, bisa jadi power supply udah gak stabil",Power Supply
"Sering nge-lag setelah beberapa waktu komputer hidup, mungkin power supply mulai bermasalah",Power Supply
"PC tiba-tiba lambat pas buka program besar, mungkin power supply udah gak mampu kasih daya cukup",Power Supply
"Lemot banget tiap kali multitasking, power supply kayaknya gak kuat nge-handle semua komponen",Power Supply
"PC mulai lambat kalau dinyalain lama, power supply mungkin udah gak stabil kasih daya",Power Supply
"Sering nge-freeze mendadak dan komputer jadi lambat, kemungkinan power supply udah mulai rusak",Power Supply
"Komputer butuh waktu lama banget buat booting, kayaknya hard disk-nya udah lelet",Hard Disk
"Saat buka file besar, loading-nya lama banget, kemungkinan hard disk bermasalah",Hard Disk
"PC jadi sangat lambat saat membuka aplikasi, mungkin ada yang salah dengan hard disk",Hard Disk
"Komputer mulai lambat, terutama waktu nge-load data besar, sepertinya hard disk udah mulai rusak",Hard Disk
"Waktu akses file, komputer jadi lambat parah, hard disk mulai sering bunyi",Hard Disk
"Lama banget tiap kali start up, komputer jadi super lambat, mungkin hard disk udah usang",Hard Disk
"Hard disk mulai terdengar suara aneh, komputer jadi lemot parah waktu nge-load aplikasi",Hard Disk
"Komputer sering lag waktu membuka program, mungkin karena hard disk udah nggak optimal",Hard Disk
"PC lambat saat menjalankan aplikasi berat, bisa jadi hard disk sudah mulai gagal",Hard Disk
"Komputer tiba-tiba lemot banget waktu proses data besar, mungkin masalah di hard disk",Hard Disk
"Komputer jadi lag setelah beberapa jam digunakan, mungkin power supply gak sanggup lagi",Power Supply
"Pas main game berat, komputer sering ngelag, mungkin power supply gak kuat",Power Supply
"PC jadi lambat banget setelah beberapa saat dipakai, mungkin power supply udah gak stabil",Power Supply
"Komputer suka tiba-tiba lemot, apalagi kalau buka banyak aplikasi sekaligus, power supply mungkin bermasalah",Power Supply
"PC sering ngelag kalau nyalain aplikasi yang berat, mungkin power supply udah gak bisa kasih daya cukup",Power Supply
"Setelah dipakai beberapa jam, PC mulai lemot, kemungkinan power supply mulai nggak stabil",Power Supply
"Komputer sering lag, terutama kalau dipakai lama, sepertinya power supply udah nggak berfungsi baik",Power Supply
"Sering freeze dan lemot pas buka game berat, mungkin power supply udah nggak mampu nyuplai daya",Power Supply
"PC sering nge-lag setelah dipakai lama, bisa jadi karena power supply nggak stabil",Power Supply
"Komputer lambat banget setelah beberapa waktu nyala, mungkin power supply udah nggak sanggup",Power Supply
"Monitor menampilkan garis-garis aneh saat komputer dinyalakan",Graphic Card
"Saat main game, tiba-tiba muncul pixel-pixel warna warni di layar",Graphic Card
"Gambar di layar sering muncul garis horizontal yang tidak hilang",Graphic Card
"Monitor tiba-tiba menampilkan blok-blok warna yang bergerak saat browsing",Graphic Card
"Saat rendering video, layar menampilkan pola garis dan gambar jadi buram",Graphic Card
"Gambarnya seperti retak dengan pixel rusak di beberapa bagian",Graphic Card
"Monitor menampilkan kotak-kotak hitam dan putih setelah komputer digunakan beberapa menit",Graphic Card
"Saat bermain game, layar penuh dengan garis vertikal",Graphic Card
"Tiba-tiba muncul pola aneh di layar saat menonton video, seperti rusak",Graphic Card
"Gambar di layar bergetar dan muncul titik-titik warna acak",Graphic Card
"Setiap kali membuka aplikasi grafis, monitor menampilkan artefak aneh",Graphic Card
"Monitor menunjukkan garis-garis berkedip ketika menggunakan software desain grafis",Graphic Card
"Gambarnya jadi pecah-pecah dengan warna yang berubah tiba-tiba",Graphic Card
"Layar monitor menampilkan pixel-pixel yang bergerak saat menjalankan game berat",Graphic Card
"Ketika menyalakan komputer, gambar di layar tampak seperti patah-patah dengan garis warna",Graphic Card
"Artefak grafis muncul saat GPU digunakan untuk aplikasi berat, layar jadi buram",Graphic Card
"Monitor menunjukkan pola aneh dan warna berkedip-kedip saat rendering",Graphic Card
"Layar tiba-tiba menampilkan blok-blok besar berwarna biru dan hijau",Graphic Card
"Muncul distorsi gambar dengan banyak garis ketika video diputar",Graphic Card
"Layar tiba-tiba berisi pola-pola warna yang tidak seharusnya muncul saat menggunakan aplikasi 3D",Graphic Card
"Saat browsing biasa, tiba-tiba kipas CPU berputar kencang banget",Fan Cooler
"Kipas pendingin langsung berisik pas buka YouTube, padahal cuma nonton video",Fan Cooler
"Cuma buka browser, tapi kipas CPU suaranya jadi kayak pesawat",Fan Cooler
"Kipas pendingin mulai bunyi kencang begitu buka beberapa tab di Chrome",Fan Cooler
"Pas lagi nonton film di Netflix, kipas CPU bunyinya kencang banget terus",Fan Cooler
"Hanya browsing biasa, tapi kipas komputer langsung berisik",Fan Cooler
"Saat streaming video, tiba-tiba kipas pendingin suaranya jadi keras",Fan Cooler
"Kipas CPU mulai berisik tiap kali nonton film di laptop, padahal gak ngapa-ngapain yang berat",Fan Cooler
"Waktu buka situs streaming, kipas pendingin CPU bunyi kayak mesin jet",Fan Cooler
"Kipas cooler tiba-tiba mengeluarkan suara bising pas buka tab baru di browser",Fan Cooler
"Setiap kali buka browser buat streaming, kipas langsung berputar kencang dan berisik",Fan Cooler
"Pas nonton film atau video di laptop, kipas CPU suaranya jadi keras banget",Fan Cooler
"Kipas cooler bunyinya kencang padahal cuma browsing biasa",Fan Cooler
"Streaming video bikin kipas CPU jadi overdrive, suaranya kayak vacuum cleaner",Fan Cooler
"Buka aplikasi streaming, kipas cooler langsung mengeluarkan suara berisik",Fan Cooler
"Saat nonton film HD, kipas cooler CPU bunyinya jadi makin keras",Fan Cooler
"Hanya buka beberapa tab di browser, tapi kipas cooler bunyi terus",Fan Cooler
"Pas lagi browsing artikel, tiba-tiba kipas pendingin CPU berisik banget",Fan Cooler
"Setiap kali nonton video di internet, kipas pendingin CPU jadi berputar kencang dan mengganggu",Fan Cooler
"Pas lagi buka browser buat nonton, kipas CPU mulai bunyi bising gak karuan",Fan Cooler
"Komputer terus restart sendiri setelah beberapa menit dinyalakan",RAM
"PC mati nyala terus menerus, kayaknya karena masalah di RAM",RAM
"Setelah upgrade RAM, komputer jadi sering mati nyala terus",RAM
"Komputer nggak bisa masuk Windows, mati nyala sendiri, kemungkinan RAM bermasalah",RAM
"Komputer terus reboot secara acak, curiga ada yang salah dengan RAM",RAM
"Setiap kali dinyalakan, komputer restart sendiri tanpa henti",RAM
"PC gue nyala sebentar terus mati lagi, kayaknya ada masalah di RAM",RAM
"Komputer langsung mati setelah dihidupkan, lalu nyala lagi, terus begitu terus",RAM
"PC restart sendiri terus-terusan pas mau masuk sistem, mungkin karena RAM",RAM
"Komputer gak bisa booting dengan benar, malah restart terus menerus",RAM
"PC langsung mati dan nyala lagi setelah dinyalakan, kayaknya ada masalah di RAM",RAM
"Komputer reboot terus-menerus tanpa sempat masuk ke desktop, kemungkinan RAM rusak",RAM
"Setelah ganti RAM, komputer jadi sering restart sendiri",RAM
"Komputer gak stabil, sering mati nyala sendiri, sepertinya RAM-nya bermasalah",RAM
"Komputer nyala sebentar, terus mati lagi, kemungkinan RAM yang bikin masalah",RAM
"Setiap kali dinyalakan, komputer cuma restart tanpa henti, ada yang salah di RAM",RAM
"PC terus-menerus reboot tanpa pernah masuk ke Windows, kemungkinan RAM rusak",RAM
"Komputer gak bisa nyala normal, restart terus pas baru dihidupkan",RAM
"Komputer restart berkali-kali, kayaknya masalah RAM yang bikin gak stabil",RAM
"PC terus reboot pas nyala, kayaknya ada masalah di RAM",RAM
"Komputer tidak mau menyala meskipun sudah ditekan tombol power",Processor
"Layar komputer tetap hitam saat dinyalakan tanpa ada tampilan apapun",Processor
"Komputer tiba-tiba mati saat digunakan untuk rendering video",Processor
"Proses booting berhenti di layar hitam tanpa logo atau animasi",Processor
"Komputer sering hang ketika membuka beberapa aplikasi sekaligus",Processor
"Komputer tidak bisa masuk BIOS dan langsung mati setelah dinyalakan",Processor
"Suara beep berulang kali terdengar saat komputer dihidupkan",Processor
"Komputer sering mengalami BSOD saat digunakan untuk browsing",Processor
"Komputer mendadak mati saat digunakan untuk bermain game",Processor
"Komputer tidak bisa di-restart, hanya menampilkan layar hitam",Processor
"Komputer panas berlebihan meskipun hanya digunakan untuk mengetik",Processor
"Komputer mengalami lag yang sangat parah saat memutar video HD",Processor
"Layar komputer tiba-tiba mati tanpa pesan error apapun",Processor
"Suara kipas terdengar sangat keras tetapi komputer tetap lambat",Processor
"Komputer freeze setelah beberapa menit digunakan",Processor
"Komputer tidak merespons saat ditekan tombol apapun di keyboard",Processor
"Proses booting sangat lama dan terkadang berhenti di tengah jalan",Processor
"Komputer mati mendadak dan butuh waktu lama untuk bisa dinyalakan lagi",Processor
"Komputer restart sendiri tanpa alasan jelas saat menjalankan program berat",Processor
"Komputer menampilkan pesan error kernel panic saat proses booting",Processor
"Komputer sering mengalami BSOD tanpa alasan jelas",RAM
"Program tiba-tiba tertutup saat digunakan tanpa pesan error",RAM
"Komputer restart sendiri ketika membuka banyak tab browser",RAM
"Aplikasi berjalan sangat lambat meskipun spesifikasi cukup",RAM
"File yang disimpan tiba-tiba hilang atau rusak",RAM
"Komputer tidak bisa masuk ke OS setelah update",RAM
"Layar hitam muncul setelah proses booting",RAM
"Komputer menampilkan pesan 'Memory could not be read'",RAM
"Komputer mendeteksi kapasitas RAM yang salah",RAM
"Komputer sering freeze saat melakukan multitasking",RAM
"Suara beep berulang kali terdengar saat komputer dinyalakan",RAM
"Aplikasi sering crash saat proses render",RAM
"Kapasitas RAM tidak terbaca penuh di sistem",RAM
"Komputer tiba-tiba mati saat menjalankan game",RAM
"Proses boot sangat lambat, terutama setelah restart",RAM
"Komputer sering hang saat membuka file besar",RAM
"Komputer butuh waktu lama untuk shutdown",RAM
"Prosesor panas saat RAM digunakan intensif",RAM
"Komputer mengeluarkan kode error 'Out of Memory'",RAM
"Layar berkedip saat menjalankan aplikasi tertentu",RAM
"Komputer tidak menyala sama sekali saat ditekan power",Motherboard
"Komputer sering mati mendadak tanpa alasan",Motherboard
"Beberapa port USB tidak berfungsi",Motherboard
"Komputer sering restart sendiri saat digunakan",Motherboard
"Suara beep panjang terdengar saat booting",Motherboard
"Komputer tidak bisa masuk ke BIOS",Motherboard
"Komputer mengalami overheat walaupun tidak digunakan intensif",Motherboard
"Tidak ada tampilan di layar saat komputer dinyalakan",Motherboard
"Beberapa komponen tidak terdeteksi di sistem",Motherboard
"Komputer sering hang saat dihidupkan dari sleep mode",Motherboard
"Fan CPU tidak berputar dengan normal",Motherboard
"Performa komputer menurun drastis tanpa sebab",Motherboard
"Komputer freeze saat menjalankan program berat",Motherboard
"Komputer mati saat menghubungkan perangkat USB",Motherboard
"Komputer tidak mengeluarkan suara dari speaker onboard",Motherboard
"Komputer lambat saat booting",Motherboard
"Komputer gagal booting setelah reset BIOS",Motherboard
"Koneksi internet tidak stabil karena LAN rusak",Motherboard
"Baterai CMOS cepat habis",Motherboard
"Keyboard dan mouse sering disconnect",Motherboard
"Komputer tidak mau menyala sama sekali",Power Supply
"Komputer tiba-tiba mati saat digunakan",Power Supply
"Terdengar suara mendesis dari dalam casing",Power Supply
"Lampu indikator power berkedip terus-menerus",Power Supply
"Fan tidak berputar saat komputer dinyalakan",Power Supply
"Komputer sering restart sendiri tanpa sebab",Power Supply
"Suara kipas sangat keras saat power supply bekerja",Power Supply
"Komputer tidak menyala meskipun indikator power menyala",Power Supply
"Komputer mati mendadak saat digunakan untuk gaming",Power Supply
"Komponen lain seperti GPU tidak mendapatkan daya",Power Supply
"Lampu indikator motherboard berkedip-kedip",Power Supply
"Komputer overheat meskipun hanya digunakan ringan",Power Supply
"Komputer tidak bisa booting dari cold boot",Power Supply
"Monitor mati sendiri ketika komputer dinyalakan",Power Supply
"Performa komputer menurun saat beban tinggi",Power Supply
"Komputer mengalami lonjakan daya",Power Supply
"Komputer sering mati saat dihubungkan ke perangkat eksternal",Power Supply
"Komputer lambat menyala saat dihidupkan",Power Supply
"Komputer mati mendadak tanpa bisa menyala kembali",Power Supply
"Komputer menunjukkan tanda-tanda korsleting",Power Supply
"Komputer cepat panas meskipun tidak digunakan berat",Fan Cooler
"Suara kipas sangat berisik saat komputer dinyalakan",Fan Cooler
"Fan tidak berputar meskipun komputer menyala",Fan Cooler
"Komputer mendadak mati saat beban CPU meningkat",Fan Cooler
"Terdengar bunyi gesekan dari kipas dalam casing",Fan Cooler
"Komputer overheat dalam waktu singkat",Fan Cooler
"Kinerja komputer menurun karena panas berlebih",Fan Cooler
"Komputer restart sendiri saat suhu meningkat",Fan Cooler
"Suhu CPU meningkat drastis dalam hitungan menit",Fan Cooler
"Suara kipas terdengar sangat lemah",Fan Cooler
"Komputer hang saat menjalankan aplikasi berat",Fan Cooler
"Kipas tidak berfungsi meskipun suhu CPU tinggi",Fan Cooler
"Terdengar suara kipas yang bergemuruh",Fan Cooler
"Komputer freeze saat rendering",Fan Cooler
"Komputer cepat panas meskipun fan diatur maksimal",Fan Cooler
"Fan hanya berputar sebentar saat komputer menyala",Fan Cooler
"Suhu CPU stabil di angka tinggi",Fan Cooler
"Komputer lambat karena suhu berlebihan",Fan Cooler
"Suara kipas tidak konsisten saat bekerja",Fan Cooler
"Komputer menunjukkan warning CPU overheating",Fan Cooler
"Layar menampilkan garis-garis horizontal",Graphic Card
"Komputer hang saat menjalankan aplikasi grafis",Graphic Card
"Komputer mati mendadak saat rendering video",Graphic Card
"FPS drop drastis saat bermain game",Graphic Card
"Layar berkedip saat membuka aplikasi tertentu",Graphic Card
"Fan GPU berputar sangat cepat tanpa sebab",Graphic Card
"Layar menampilkan warna aneh",Graphic Card
"Komputer sering restart saat bermain game",Graphic Card
"Layar tidak menampilkan gambar meskipun komputer menyala",Graphic Card
"Komputer freeze saat GPU dipakai intensif",Graphic Card
"Komputer crash saat menjalankan aplikasi grafis berat",Graphic Card
"Layar hitam muncul saat GPU digunakan",Graphic Card
"Suara kipas GPU sangat berisik",Graphic Card
"Komputer sering BSOD dengan pesan terkait GPU",Graphic Card
"Suhu GPU tinggi saat idle",Graphic Card
"Komputer mati mendadak saat menggunakan 3D rendering",Graphic Card
"Driver GPU sering mengalami error",Graphic Card
"Komputer lambat saat mengolah grafik",Graphic Card
"Output video tidak terdeteksi",Graphic Card
"Game sering lag meskipun spesifikasi GPU mencukupi",Graphic Card
"Komputer tidak mau menyala",Processor
"Komputer mati mendadak saat rendering video",Processor
"Layar hitam tanpa tampilan saat booting",Processor
"Prosesor overheat meskipun penggunaan ringan",Processor
"Komputer sering hang saat multitasking",Processor
"Komputer tidak bisa masuk BIOS",Processor
"Komputer freeze tanpa sebab jelas",Processor
"Komputer restart sendiri saat beban CPU tinggi",Processor
"Komputer lambat dalam membuka aplikasi",Processor
"Komputer tiba-tiba mati saat bermain game",Processor
"BSOD saat menjalankan aplikasi berat",Processor
"Sistem crash saat rendering",Processor
"Suara beep terus terdengar saat boot",Processor
"Komputer sering freeze di layar boot",Processor
"Suhu CPU tinggi bahkan di idle",Processor
"Komputer butuh waktu lama untuk boot",Processor
"Komputer tidak responsif",Processor
"Komputer tiba-tiba restart",Processor
"Komputer sering mati tanpa alasan",Processor
"Aplikasi crash saat CPU digunakan intensif",Processor
"Komputer gagal membaca drive saat startup",Hard Disk
"Folder atau file sering mengalami korupsi setelah disimpan",Hard Disk
"Komputer melambat drastis saat memindahkan file",Hard Disk
"Suara klik atau ketukan terdengar dari hard disk",Hard Disk
"Proses pencarian file sangat lambat",Hard Disk
"Komputer melakukan disk check secara otomatis saat startup",Hard Disk
"Proses instalasi software sering gagal",Hard Disk
"File yang baru di-download atau disalin tiba-tiba hilang",Hard Disk
"Komputer mengalami BSOD dengan kode terkait storage",Hard Disk
"Data yang tersimpan tidak bisa diakses atau terbaca",Hard Disk
"Komputer freeze saat mengakses file lama",Hard Disk
"Hard disk tidak muncul di daftar perangkat penyimpanan",Hard Disk
"Komputer butuh waktu lama untuk membuka direktori besar",Hard Disk
"Proses backup sering gagal di tengah jalan",Hard Disk
"Kapasitas drive terbaca tidak sesuai dengan ukuran sebenarnya",Hard Disk
"Layar menampilkan artefak visual atau titik-titik aneh",Graphic Card
"Komputer tiba-tiba freeze saat menonton video",Graphic Card
"GPU mencapai suhu tinggi tanpa penggunaan intensif",Graphic Card
"Layar berubah menjadi warna acak atau pola saat bermain game",Graphic Card
"Driver GPU sering membutuhkan reset ulang untuk berfungsi",Graphic Card